{
  "meta": {
    "researcher": "Anonymous parent",
    "context": "Parent raising kids who are learning English and wants them to sound more native. No linguistics background assumed.",
    "mode": "solo",
    "generated_by": "dont-stop-research v1.0",
    "generated_at": "2026-07-28",
    "status": "draft",
    "original_question": "how to teach my kids to speak English more natively?",
    "working_question": "What kind of English exposure actually changes how my kids speak — and which parts of \"sounding native\" are still movable at their age?",
    "triage_summary": "The original invited tips any parenting blog could supply, left \"more natively\" ambiguous across four different targets (accent, grammar, vocabulary, idiom) that move on different timetables, and assumed the goal — whether native-likeness is even the right target is itself a live dispute. Revised to split the movable from the less-movable and to force choosing between rival accounts: more input, richer input, earlier input, or a different target altogether.",
    "purpose": "Personal — parenting decision, no deadline",
    "staleness_note": "The underlying studies are stable classics (1999–2018); staleness risk is low. Re-check only if a major new critical-period study lands."
  },
  "root": {
    "id": "root",
    "label": "What moves the needle?",
    "note": "Sharpened from \"how to teach my kids to speak English more natively?\" — split into which parts of sounding native are still movable, and what kind of exposure moves them."
  },
  "questions": [
    {
      "id": "Q1",
      "parent": "root",
      "label": "Native — meaning what?",
      "question": "\"More natively\" — do you mean accent, grammar, vocabulary, or idiom? Pick the one that bothers you when you hear it. Would your kids agree it's a problem — and native like WHOM, exactly?",
      "type": { "n": 1, "name": "Meaning", "move": "clarification" },
      "relevance_group": "supporting",
      "difficulty": "easy",
      "readings": [
        { "role": "primary", "source": "S6" }
      ],
      "single_reading_reason": "One reading suffices — the card's work is a decision you make, and the reading exists to clear myths out of the way of it, not to add a second account.",
      "check_first": "Search \"François Grosjean\" alone. What did he do before writing blogs, and does a blog by a career researcher carry different weight than a blog by a parenting site?",
      "read_for": "Which of the listed myths you currently believe. Note the claim that most of the world's bilinguals are dominant in one language — and ask what that does to \"native in both\" as a target.",
      "level": "Easy — a short readable blog post. The work is the decision it forces, not the reading. ~15 min."
    },
    {
      "id": "Q2",
      "parent": "root",
      "label": "How open is the window?",
      "question": "The largest study ever run on this — two-thirds of a million English speakers — found grammar-learning ability stays high until around 17. If the window is that open, why do kids who start at 5 still end up sounding different from kids who start at 15?",
      "type": { "n": 2, "name": "Landscape", "move": "probing reasons and evidence" },
      "relevance_group": "core",
      "difficulty": "middle",
      "readings": [
        { "role": "primary", "source": "S1" },
        { "role": "supporting", "source": "S3" }
      ],
      "check_first": "This study collected its data through a viral internet grammar quiz. Search \"Hartshorne critical period quiz methodology criticism\" — find one objection to learning from a viral quiz before you lean on the result.",
      "read_for": "What was measured: GRAMMAR judgments, not accent, not vocabulary. Note the age the learning-rate cliff actually sits at, and how long they estimate reaching the ceiling takes. Both numbers should surprise you.",
      "level": "Middle. The paper's middle is computational modelling — skip it. Abstract, figures, and discussion carry what you need. ~35 min."
    },
    {
      "id": "Q3",
      "parent": "root",
      "label": "Why did video deliver zero?",
      "question": "Nine-month-old babies learned Mandarin sounds from a live person in twelve short sessions. Babies shown the SAME person saying the SAME things on video learned nothing at all. Why would a screen — identical input — deliver zero?",
      "type": { "n": 3, "name": "Mechanism", "move": "contrastive why" },
      "relevance_group": "core",
      "difficulty": "technical",
      "load_bearing": false,
      "readings": [
        { "role": "primary", "source": "S2" }
      ],
      "single_reading_reason": "One reading because the finding IS one experiment, and its force comes from the clean live-vs-video contrast. A second account would blur exactly the edge that makes it useful.",
      "check_first": "Search \"Patricia Kuhl TED talk\" — she has explained this study to lay audiences herself. Watching it first is legitimate scaffolding; then read the paper to see what the talk smoothed over.",
      "read_for": "The live-vs-recorded contrast and the authors' own explanation of WHY. Then note the participants' age, and write down — before anyone tells you — your best argument for and against this applying to a school-age child.",
      "level": "Technical — a real PNAS paper with methods and statistics. The figures plus the discussion section carry it. ~40 min."
    },
    {
      "id": "Q4",
      "parent": "root",
      "label": "Same years, different results",
      "question": "Two kids, same school, same number of years in English. One sounds nearly native, one doesn't. The research measured what differs between such kids — how much of it turns out to be things a parent controls, and how much is the kid?",
      "type": { "n": 3, "name": "Mechanism", "move": "contrastive why" },
      "relevance_group": "core",
      "difficulty": "middle",
      "readings": [
        { "role": "primary", "source": "S5" },
        { "role": "supporting", "source": "S2" }
      ],
      "check_first": "Search \"Johanne Paradis child English second language\" — what population does she mostly study, and how similar is it to your household's situation?",
      "read_for": "The list of what \"richness of the English environment\" actually consisted of — it is concrete and shorter than you'd guess — and the honest headline that child-internal factors explained more of the variance. Hold both.",
      "level": "Middle — an academic paper, but the factor tables are readable and carry the payload. ~35 min."
    },
    {
      "id": "Q5",
      "parent": "root",
      "label": "Clock, exposure, or wrong target?",
      "question": "Three serious positions, all evidence-backed: (a) there's a sharp age cliff, so timing is everything; (b) the age effect on grammar largely dissolves once you control for education and use — so it's exposure, not a clock; (c) chasing native-likeness at all is the wrong goal, because a bilingual is not two monolinguals in one. They can't all govern your house. State the one you end up rejecting, fairly enough that its holder would sign it.",
      "type": { "n": 4, "name": "Tension", "move": "viewpoints and perspectives" },
      "relevance_group": "core",
      "difficulty": "technical",
      "load_bearing": true,
      "readings": [
        { "role": "primary", "source": "S4" },
        { "role": "supporting", "source": "S1" },
        { "role": "background", "source": "S3" }
      ],
      "check_first": "Search \"native speakerism criticism\" and, separately, \"critical period hypothesis defense\". Both camps have serious people. Find one name on each side who is not in your source list.",
      "read_for": "Cook: the argument that L2 users are speakers in their own right, not failed natives — and what he says classrooms should do differently. Then re-read Flege's abstract asking one question: what happened to the grammar-age effect when confounds were controlled?",
      "level": "Technical in the values-wearing-empirical-clothes way. Sort each claim into \"testable\" or \"a choice about goals\" before picking a side. ~50 min including re-reading."
    },
    {
      "id": "Q6",
      "parent": "root",
      "label": "How is \"native\" measured?",
      "question": "\"Sounds native\" feels obvious to your ear — but how do researchers actually measure it? In the classic study, 240 speakers were rated by listeners for accent. What would your kids' recordings score, and what would count as \"made it\"?",
      "type": { "n": 5, "name": "Evidence", "move": "probing reasons and evidence" },
      "relevance_group": "supporting",
      "difficulty": "middle",
      "readings": [
        { "role": "primary", "source": "S3" },
        { "role": "background", "source": "S6" }
      ],
      "check_first": "The reachable copy is hosted on a university course page, not the journal. Search the paper's title plus \"Journal of Memory and Language\" to confirm the course copy matches a real published article before citing it.",
      "read_for": "How the accent ratings were collected and what the accent-vs-age curve looks like. Then the abstract's second finding: what happened to the GRAMMAR effect under controls — and why that split matters more than either result alone.",
      "level": "Middle — long paper, but abstract, method sketch, and two figures carry it. ~35 min."
    },
    {
      "id": "Q7",
      "parent": "root",
      "label": "Does immersion research transfer?",
      "question": "Nearly every study here follows immigrants immersed in an English-speaking country. If English isn't the language of your street and playground, which findings still transfer to your house — and which quietly assumed twelve hours a day of free immersion?",
      "type": { "n": 6, "name": "Scope", "move": "implications and consequences" },
      "relevance_group": "context",
      "difficulty": "easy",
      "readings": [],